[
  {
    "subject": "Winter Is Coming: Secure Your Trailer",
    "preview": "Peace of mind for your trailer this winter, guaranteed by AMPLOCK.",
    "hero_title": "Winter storage requires strong security",
    "hero_subtitle": "Protect your trailer or RV from seasonal theft risk.",
    "cta_hero": "View Tools",
    "descriptive_block_title": "Why winter security matters now",
    "descriptive_block_subtitle": "Prevent loss with robust protection and expert tips.",
    "descriptive_block_content": "<h3>Protect your trailer this winter.</h3><br><p>When temperatures drop, trailers and RVs often sit unused for weeks\u2014making them <b>prime targets for theft</b>.</p><br><p>With AMPLOCK locks, you can move from <b>constant worry to total peace of mind</b>. Your investment stays secure, even when you can\u2019t check on it daily.</p><br><p><i>Prevention is always easier than recovery. Protect what matters most this season.</i></p>",
    "cta_descriptive": "See Security Options",
    "product_block_title": "Choose your winter protection",
    "product_block_subtitle": "AMPLOCK offers advanced locks for every trailer and RV. Durable, trusted, and built for harsh conditions.",
    "products": [
      "Ball Coupler Locks",
      "Kingpin Locks",
      "Trailer Door & Container Locks"
    ],
    "product_block_content": null,
    "cta_product": "See Collection",
    "full_text_formatted": "\nSUBJECT: Winter Is Coming: Secure Your Trailer\nPREVIEW: Peace of mind for your trailer this winter, guaranteed by AMPLOCK.\nHERO IMAGE: Winter storage requires strong security (Placeholder)\nHERO TITLE: Winter storage requires strong security\nHERO SUBTITLE: Protect your trailer or RV from seasonal theft risk.\nCTA: View Tools\n\n--- DESCRIPTIVE BLOCK ---\nTITLE: Why winter security matters now\nCONTENT: When temperatures fall, trailers and RVs often remain unused for weeks. This creates a higher risk, as they become prime targets for theft during winter. You can move from constant worry to total peace of mind by choosing the right protection. Relying on robust AMPLOCK locks means your investment stays secure, even when you cannot check on it every day. Prevention is always easier than recovery. Use our practical advice to safeguard what matters most and see how AMPLOCK keeps your assets secure all season.\nCTA DESCRIPTIVE: See Security Options\n\n--- PRODUCTS ---\n- Ball Coupler Locks\n- Kingpin Locks\n- Trailer Door & Container Locks\nCTA: See Collection\n\n--- FOOTER ---\nN/A\n",
    "slot_number": 1,
    "status": "completed",
    "content": "\nSUBJECT: Winter Is Coming: Secure Your Trailer\nPREVIEW: Peace of mind for your trailer this winter, guaranteed by AMPLOCK.\nHERO IMAGE: Winter storage requires strong security (Placeholder)\nHERO TITLE: Winter storage requires strong security\nHERO SUBTITLE: Protect your trailer or RV from seasonal theft risk.\nCTA: View Tools\n\n--- DESCRIPTIVE BLOCK ---\nTITLE: Why winter security matters now\nCONTENT: When temperatures fall, trailers and RVs often remain unused for weeks. This creates a higher risk, as they become prime targets for theft during winter. You can move from constant worry to total peace of mind by choosing the right protection. Relying on robust AMPLOCK locks means your investment stays secure, even when you cannot check on it every day. Prevention is always easier than recovery. Use our practical advice to safeguard what matters most and see how AMPLOCK keeps your assets secure all season.\nCTA DESCRIPTIVE: See Security Options\n\n--- PRODUCTS ---\n- Ball Coupler Locks\n- Kingpin Locks\n- Trailer Door & Container Locks\nCTA: See Collection\n\n--- FOOTER ---\nN/A\n",
    "structure_id": "STRUCT_NARRATIVE_PARAGRAPH",
    "language": "EN"
  }
]