[
  {
    "subject": "Which AMPLOCK fits your trailer best?",
    "preview": "Expert tips to pick the perfect lock this winter.",
    "hero_title": "Find the right AMPLOCK for your trailer",
    "hero_subtitle": "Expert tips for total security this winter and beyond.",
    "cta_hero": "See your options",
    "descriptive_block_title": "Confident Protection Starts Here",
    "descriptive_block_subtitle": "Match the right lock to your equipment for real peace of mind.",
    "descriptive_block_content": "<h3>Protect your trailer this winter</h3><br><ul><li><b>\ud83d\udd12 Ultimate security:</b> AMPLOCK locks are built with top-grade steel to withstand cold and corrosion.</li><li><b>\u2744\ufe0f Winter-ready design:</b> Engineered to perform even in the toughest conditions.</li><li><b>\ud83d\udee0\ufe0f Tailored protection:</b> Easily match the perfect lock to your trailer type for total peace of mind.</li></ul>",
    "cta_descriptive": "Explore secure lock types",
    "product_block_title": "Ready to Protect Your Equipment?",
    "product_block_subtitle": "Winter risks are rising, and security cannot wait. Act now to protect your trailer during long periods of inactivity with AMPLOCK\u2019s trusted locks.",
    "products": [
      "Ball Coupler Locks",
      "Kingpin Locks",
      "Trailer Door and Container Locks"
    ],
    "product_block_content": null,
    "cta_product": "View Tools",
    "full_text_formatted": "\nSUBJECT: Which AMPLOCK fits your trailer best?\nPREVIEW: Expert tips to pick the perfect lock this winter.\nHERO IMAGE: Find the right AMPLOCK for your trailer (Placeholder)\nHERO TITLE: Find the right AMPLOCK for your trailer\nHERO SUBTITLE: Expert tips for total security this winter and beyond.\nCTA: See your options\n\n--- DESCRIPTIVE BLOCK ---\nTITLE: Confident Protection Starts Here\nCONTENT: Secure every trailer with AMPLOCK\u2019s range of ball coupler, kingpin, and door locks. Engineered for winter, our locks use top-grade steel for strength against cold and corrosion. You will feel confident knowing your trailer is protected, even during winter\u2019s toughest conditions. We make it easy to match the perfect lock to your trailer type, so you can relax and enjoy true peace of mind. Choosing the right lock now gives you security for the entire season.\nCTA DESCRIPTIVE: Explore secure lock types\n\n--- PRODUCTS ---\n- Ball Coupler Locks\n- Kingpin Locks\n- Trailer Door and Container Locks\nCTA: View Tools\n\n--- FOOTER ---\nN/A\n",
    "slot_number": 2,
    "status": "completed",
    "content": "\nSUBJECT: Which AMPLOCK fits your trailer best?\nPREVIEW: Expert tips to pick the perfect lock this winter.\nHERO IMAGE: Find the right AMPLOCK for your trailer (Placeholder)\nHERO TITLE: Find the right AMPLOCK for your trailer\nHERO SUBTITLE: Expert tips for total security this winter and beyond.\nCTA: See your options\n\n--- DESCRIPTIVE BLOCK ---\nTITLE: Confident Protection Starts Here\nCONTENT: Secure every trailer with AMPLOCK\u2019s range of ball coupler, kingpin, and door locks. Engineered for winter, our locks use top-grade steel for strength against cold and corrosion. You will feel confident knowing your trailer is protected, even during winter\u2019s toughest conditions. We make it easy to match the perfect lock to your trailer type, so you can relax and enjoy true peace of mind. Choosing the right lock now gives you security for the entire season.\nCTA DESCRIPTIVE: Explore secure lock types\n\n--- PRODUCTS ---\n- Ball Coupler Locks\n- Kingpin Locks\n- Trailer Door and Container Locks\nCTA: View Tools\n\n--- FOOTER ---\nN/A\n",
    "structure_id": "STRUCT_EMOJI_CHECKLIST",
    "language": "EN"
  },
  {
    "subject": "Peace of Mind: A True Security Story",
    "preview": "See how AMPLOCK brings lasting relief this winter.",
    "hero_title": "Regret or Relief? One Customer\u2019s Journey",
    "hero_subtitle": "Protect your trailer this winter with proven security.",
    "cta_hero": "Explore AMPLOCK Solutions",
    "descriptive_block_title": "From Anxiety to Confidence",
    "descriptive_block_subtitle": "A heartfelt story of transformation through AMPLOCK",
    "descriptive_block_content": "<div style='text-align: center; font-style: italic; padding: 15px;'><p>&quot;After my trailer was stolen, I felt helpless and constantly worried it could happen again. Installing AMPLOCK became my turning point. It gave me back my confidence and finally let me sleep easy. Knowing my equipment is truly secure has made all the difference.&quot;</p><br><p><b>\u2014 Michael T.</b>, Verified Buyer</p></div>",
    "cta_descriptive": "Secure Your Peace of Mind",
    "product_block_title": "AMPLOCK: The Solution Behind Relief",
    "product_block_subtitle": "Each lock is built to prevent theft and protect trailers during downtime. Michael and thousands more trust AMPLOCK for year round security and true peace of mind.",
    "products": [
      "Ball Coupler Locks",
      "Kingpin Locks",
      "Trailer Door & Container Locks"
    ],
    "product_block_content": "AMPLOCK locks are designed to stop theft before it starts. Whether your trailer is parked for the season or in daily use, each lock provides the strong protection that brings lasting peace of mind.",
    "cta_product": "See Full Collection",
    "full_text_formatted": "\nSUBJECT: Peace of Mind: A True Security Story\nPREVIEW: See how AMPLOCK brings lasting relief this winter.\nHERO IMAGE: Regret or Relief? One Customer\u2019s Journey (Placeholder)\nHERO TITLE: Regret or Relief? One Customer\u2019s Journey\nHERO SUBTITLE: Protect your trailer this winter with proven security.\nCTA: Explore AMPLOCK Solutions\n\n--- DESCRIPTIVE BLOCK ---\nTITLE: From Anxiety to Confidence\nCONTENT: \"After my trailer was stolen, I felt helpless and constantly worried it could happen again. Installing AMPLOCK became my turning point. It gave me back my confidence and finally let me sleep easy. Knowing my equipment is truly secure has made all the difference.\"\nMichael T.\n\nThis kind of transformation is what AMPLOCK is all about. When regret is replaced by relief, you regain control over your peace of mind. Discover the solution that made this possible.\nCTA DESCRIPTIVE: Secure Your Peace of Mind\n\n--- PRODUCTS ---\n- Ball Coupler Locks\n- Kingpin Locks\n- Trailer Door & Container Locks\nCTA: See Full Collection\n\n--- FOOTER ---\nN/A\n",
    "slot_number": 3,
    "status": "completed",
    "content": "\nSUBJECT: Peace of Mind: A True Security Story\nPREVIEW: See how AMPLOCK brings lasting relief this winter.\nHERO IMAGE: Regret or Relief? One Customer\u2019s Journey (Placeholder)\nHERO TITLE: Regret or Relief? One Customer\u2019s Journey\nHERO SUBTITLE: Protect your trailer this winter with proven security.\nCTA: Explore AMPLOCK Solutions\n\n--- DESCRIPTIVE BLOCK ---\nTITLE: From Anxiety to Confidence\nCONTENT: \"After my trailer was stolen, I felt helpless and constantly worried it could happen again. Installing AMPLOCK became my turning point. It gave me back my confidence and finally let me sleep easy. Knowing my equipment is truly secure has made all the difference.\"\nMichael T.\n\nThis kind of transformation is what AMPLOCK is all about. When regret is replaced by relief, you regain control over your peace of mind. Discover the solution that made this possible.\nCTA DESCRIPTIVE: Secure Your Peace of Mind\n\n--- PRODUCTS ---\n- Ball Coupler Locks\n- Kingpin Locks\n- Trailer Door & Container Locks\nCTA: See Full Collection\n\n--- FOOTER ---\nN/A\n",
    "structure_id": "STRUCT_SOCIAL_PROOF_QUOTE",
    "language": "EN"
  },
  {
    "subject": "Ready for Adventure? Secure & Save by Jan 25!",
    "preview": "AMPLOCK\u2019s special deal ends Jan 25. Secure your gear now.",
    "hero_title": "New Year Security: Offer Ends Jan 25!",
    "hero_subtitle": "Because your adventures deserve the best protection. Get AMPLOCK\u2019s premium locks at special pricing for a limited time.",
    "cta_hero": "Shop Now",
    "descriptive_block_title": "Transform Winter Worries into Summer Freedom",
    "descriptive_block_subtitle": "Stay ready for every adventure. Peace of mind starts now.",
    "descriptive_block_content": "<table width='100%' style='background-color: #f4f4f4; border-radius: 8px;'><tr><td style='padding: 20px; text-align: center;'><h3>Feel confident wherever the road leads</h3><p>Imagine setting off for your next trip knowing your <b>trailer, RV, or boat</b> is secure.<br><br>AMPLOCK is here to help you <b>leave worry behind</b>, no matter the season.<br><br>Take advantage of this exclusive deal before <b>January 25</b> and enjoy peace of mind all year.</p><br><b>Upgrade your security today</b></td></tr></table>",
    "cta_descriptive": "See Security Solutions",
    "product_block_title": "Unlock Ultimate Protection for Every Season",
    "product_block_subtitle": "Our strongest locks keep your trailer, RV, and boat safe all year. Choose your tool before the New Year deal ends.",
    "products": [
      "Ball Coupler Locks",
      "Kingpin Locks",
      "Trailer Door & Container Locks"
    ],
    "product_block_content": null,
    "cta_product": "Shop Now",
    "full_text_formatted": "\nSUBJECT: Ready for Adventure? Secure & Save by Jan 25!\nPREVIEW: AMPLOCK\u2019s special deal ends Jan 25. Secure your gear now.\nHERO IMAGE: New Year Security: Offer Ends Jan 25! (Placeholder)\nHERO TITLE: New Year Security: Offer Ends Jan 25!\nHERO SUBTITLE: Because your adventures deserve the best protection. Get AMPLOCK\u2019s premium locks at special pricing for a limited time.\nCTA: Shop Now\n\n--- DESCRIPTIVE BLOCK ---\nTITLE: Transform Winter Worries into Summer Freedom\nCONTENT: <b>Feel confident wherever the road leads.</b> Imagine setting off for your next trip knowing your trailer, RV, or boat is secure. AMPLOCK is here to help you leave worry behind, no matter the season. Take advantage of this exclusive deal before January 25 and enjoy peace of mind all year. This is your moment to upgrade your security and welcome every adventure.\nCTA DESCRIPTIVE: See Security Solutions\n\n--- PRODUCTS ---\n- Ball Coupler Locks\n- Kingpin Locks\n- Trailer Door & Container Locks\nCTA: Shop Now\n\n--- FOOTER ---\nN/A\n",
    "slot_number": 4,
    "status": "completed",
    "content": "\nSUBJECT: Ready for Adventure? Secure & Save by Jan 25!\nPREVIEW: AMPLOCK\u2019s special deal ends Jan 25. Secure your gear now.\nHERO IMAGE: New Year Security: Offer Ends Jan 25! (Placeholder)\nHERO TITLE: New Year Security: Offer Ends Jan 25!\nHERO SUBTITLE: Because your adventures deserve the best protection. Get AMPLOCK\u2019s premium locks at special pricing for a limited time.\nCTA: Shop Now\n\n--- DESCRIPTIVE BLOCK ---\nTITLE: Transform Winter Worries into Summer Freedom\nCONTENT: <b>Feel confident wherever the road leads.</b> Imagine setting off for your next trip knowing your trailer, RV, or boat is secure. AMPLOCK is here to help you leave worry behind, no matter the season. Take advantage of this exclusive deal before January 25 and enjoy peace of mind all year. This is your moment to upgrade your security and welcome every adventure.\nCTA DESCRIPTIVE: See Security Solutions\n\n--- PRODUCTS ---\n- Ball Coupler Locks\n- Kingpin Locks\n- Trailer Door & Container Locks\nCTA: Shop Now\n\n--- FOOTER ---\nN/A\n",
    "structure_id": "STRUCT_SPOTLIGHT_BOX",
    "language": "EN"
  }
]