[
  {
    "subject": "Think Your Trailer Is Safe? The Stats Say Otherwise",
    "preview": "Winter brings risks, see how to secure your trailer.",
    "hero_title": "Most Trailer Thefts Happen in 'Safe' Spots",
    "hero_subtitle": "Think your trailer is safe this winter? Here is the truth.",
    "cta_hero": "See Security Facts",
    "descriptive_block_title": "Common Myths That Cost Owners",
    "descriptive_block_subtitle": "Real stats reveal what actually protects your trailer.",
    "descriptive_block_content": "<table width='100%' style='text-align: center;'>\n  <tr>\n    <td width='33%'>\n      <h1>75%</h1><br>\n      <p>Thefts occur in \"trusted\" spots</p>\n    </td>\n    <td width='33%'>\n      <h1>65%</h1><br>\n      <p>Locks fail to prevent theft</p>\n    </td>\n    <td width='33%'>\n      <h1>0%</h1><br>\n      <p>Drop in theft during winter</p>\n    </td>\n  </tr>\n  <tr>\n    <td width='33%' valign='top'>\n      <p><b>Most thefts happen</b> where owners feel safe. Trust your protection, not your parking spot.</p>\n    </td>\n    <td width='33%' valign='top'>\n      <p><b>Simple locks aren't enough.</b> Advanced solutions are the key to securing your trailer.</p>\n    </td>\n    <td width='33%' valign='top'>\n      <p><b>Winter offers no safety.</b> Thieves target unattended equipment year-round.</p>\n    </td>\n  </tr>\n</table>",
    "cta_descriptive": "View Relevant Tools",
    "product_block_title": "AMPLOCK Protects in Toughest Conditions",
    "product_block_subtitle": "Upgrade to products that close real security gaps. AMPLOCK protects your trailer during winter and throughout the year.",
    "products": [
      "Ball Coupler Locks",
      "Kingpin Locks",
      "Trailer Door & Container Locks"
    ],
    "product_block_content": null,
    "cta_product": "See Collection",
    "full_text_formatted": "\nSUBJECT: Think Your Trailer Is Safe? The Stats Say Otherwise\nPREVIEW: Winter brings risks\u2014see how to secure your trailer.\nHERO IMAGE: Most Trailer Thefts Happen in 'Safe' Spots (Placeholder)\nHERO TITLE: Most Trailer Thefts Happen in 'Safe' Spots\nHERO SUBTITLE: Think your trailer is safe this winter? Here is the truth.\nCTA: See Security Facts\n\n--- DESCRIPTIVE BLOCK ---\nTITLE: Common Myths That Cost Owners\nCONTENT: \u2022 75% of trailer thefts occur when owners trust their parking spot. \n\u2022 65% of stolen trailers used simple locks that failed. \n\u2022 Winter does not lower theft rates. Unattended equipment is still targeted. \n\u2022 Visual deterrents and parking location cannot stop determined thieves. \nProtect your trailer with advanced locks that work even in winter's toughest conditions. AMPLOCK delivers true security.\nCTA DESCRIPTIVE: View Relevant Tools\n\n--- PRODUCTS ---\n- Ball Coupler Locks\n- Kingpin Locks\n- Trailer Door & Container Locks\nCTA: See Collection\n\n--- FOOTER ---\nN/A\n",
    "slot_number": 4,
    "status": "completed",
    "content": "\nSUBJECT: Think Your Trailer Is Safe? The Stats Say Otherwise\nPREVIEW: Winter brings risks\u2014see how to secure your trailer.\nHERO IMAGE: Most Trailer Thefts Happen in 'Safe' Spots (Placeholder)\nHERO TITLE: Most Trailer Thefts Happen in 'Safe' Spots\nHERO SUBTITLE: Think your trailer is safe this winter? Here is the truth.\nCTA: See Security Facts\n\n--- DESCRIPTIVE BLOCK ---\nTITLE: Common Myths That Cost Owners\nCONTENT: \u2022 75% of trailer thefts occur when owners trust their parking spot. \n\u2022 65% of stolen trailers used simple locks that failed. \n\u2022 Winter does not lower theft rates. Unattended equipment is still targeted. \n\u2022 Visual deterrents and parking location cannot stop determined thieves. \nProtect your trailer with advanced locks that work even in winter's toughest conditions. AMPLOCK delivers true security.\nCTA DESCRIPTIVE: View Relevant Tools\n\n--- PRODUCTS ---\n- Ball Coupler Locks\n- Kingpin Locks\n- Trailer Door & Container Locks\nCTA: See Collection\n\n--- FOOTER ---\nN/A\n",
    "structure_id": "STRUCT_STAT_ATTACK",
    "language": "EN"
  }
]