[
  {
    "subject": "Don't Miss Out: AMPLOCK's Best Seller Bundle Ends Soon!",
    "preview": "Act fast to protect your fleet with AMPLOCK\u2019s top rated locks and our satisfaction guarantee.",
    "hero_title": "Secure Your Fleet\u2019s Future Today!",
    "hero_subtitle": "Get our best sellers in one bundle for maximum inventory ROI.",
    "cta_hero": "Shop Now",
    "descriptive_block_title": "Business Leaders Trust AMPLOCK",
    "descriptive_block_subtitle": "Real results, real protection. Proven by B2B clients.",
    "descriptive_block_content": "<table width='100%' style='background-color: #f4f4f4; border-radius: 8px;'><tr><td style='padding: 20px; text-align: center;'><h3>Protect your assets with confidence</h3><p>\u201cAMPLOCK's locks protected our assets and saved us from major losses. We choose AMPLOCK for <b>reliable security</b> and <b>unmatched support</b>.\u201d</p><br><p><b>Thousands of business owners</b> trust AMPLOCK to safeguard their fleets.</p><br><p>Make the smart move for your business\u2014<b>maximize your ROI</b> and offer your customers <b>peace of mind</b>.</p><br><b>Act now: This exclusive bundle is available only for a short period.</b></td></tr></table>",
    "cta_descriptive": "See Bundle Details",
    "product_block_title": "What\u2019s Inside the Bundle Pack?",
    "product_block_subtitle": "Includes Ball Coupler, Kingpin, and Trailer Door locks. 100% satisfaction guaranteed. We cover return fees if you are not fully satisfied.",
    "products": [
      "Ball Coupler Locks",
      "Kingpin Locks",
      "Trailer Door & Container Locks"
    ],
    "product_block_content": null,
    "cta_product": "Secure Your Bundle Now!",
    "full_text_formatted": "\nSUBJECT: Don't Miss Out: AMPLOCK's Best Seller Bundle Ends Soon!\nPREVIEW: Act fast to protect your fleet with AMPLOCK\u2019s top rated locks and our satisfaction guarantee.\nHERO IMAGE: Secure Your Fleet\u2019s Future Today! (Placeholder)\nHERO TITLE: Secure Your Fleet\u2019s Future Today!\nHERO SUBTITLE: Get our best sellers in one bundle for maximum inventory ROI.\nCTA: Shop Now\n\n--- DESCRIPTIVE BLOCK ---\nTITLE: Business Leaders Trust AMPLOCK\nCONTENT: \u201cAMPLOCK's locks protected our assets and saved us from major losses. We choose AMPLOCK for reliable security and unmatched support.\u201d Thousands of business owners trust AMPLOCK to safeguard their fleets. Make the smart move for your business\u2014maximize your ROI and offer your customers peace of mind. This exclusive bundle is available only for a short period.\nCTA DESCRIPTIVE: See Bundle Details\n\n--- PRODUCTS ---\n- Ball Coupler Locks\n- Kingpin Locks\n- Trailer Door & Container Locks\nCTA: Secure Your Bundle Now!\n\n--- FOOTER ---\nN/A\n",
    "slot_number": 2,
    "status": "completed",
    "content": "\nSUBJECT: Don't Miss Out: AMPLOCK's Best Seller Bundle Ends Soon!\nPREVIEW: Act fast to protect your fleet with AMPLOCK\u2019s top rated locks and our satisfaction guarantee.\nHERO IMAGE: Secure Your Fleet\u2019s Future Today! (Placeholder)\nHERO TITLE: Secure Your Fleet\u2019s Future Today!\nHERO SUBTITLE: Get our best sellers in one bundle for maximum inventory ROI.\nCTA: Shop Now\n\n--- DESCRIPTIVE BLOCK ---\nTITLE: Business Leaders Trust AMPLOCK\nCONTENT: \u201cAMPLOCK's locks protected our assets and saved us from major losses. We choose AMPLOCK for reliable security and unmatched support.\u201d Thousands of business owners trust AMPLOCK to safeguard their fleets. Make the smart move for your business\u2014maximize your ROI and offer your customers peace of mind. This exclusive bundle is available only for a short period.\nCTA DESCRIPTIVE: See Bundle Details\n\n--- PRODUCTS ---\n- Ball Coupler Locks\n- Kingpin Locks\n- Trailer Door & Container Locks\nCTA: Secure Your Bundle Now!\n\n--- FOOTER ---\nN/A\n",
    "structure_id": "STRUCT_SPOTLIGHT_BOX",
    "language": "EN"
  }
]